{
  "id": "PLAN-001",
  "version": 1,
  "goal_id": "P01-G01",
  "goal_revision": 1,
  "created_at": "2026-08-14T17:00:00Z",
  "created_by": "architect",
  "status": "APPROVED",
  "tasks": [
    {
      "id": "T-001",
      "goal_id": "P01-G01",
      "plan_id": "PLAN-001",
      "title": "Verify Schema Contracts",
      "objective": "Verify all JSON schemas validate positive and negative fixtures.",
      "dependencies": [],
      "role": "tester",
      "required_skills": [
        "testing-quality"
      ],
      "status": "DONE"
    },
    {
      "id": "T-002",
      "goal_id": "P01-G01",
      "plan_id": "PLAN-001",
      "title": "Simulate End-to-End Run",
      "objective": "Execute deterministic fake runtime pass.",
      "dependencies": [
        "T-001"
      ],
      "role": "implementer",
      "required_skills": [
        "clean-code"
      ],
      "status": "DONE"
    }
  ],
  "edges": [
    {
      "from": "T-001",
      "to": "T-002"
    }
  ],
  "assumptions": [
    "Python 3.10+ runtime available"
  ],
  "risks": [
    "Schema drift without CI enforcement"
  ]
}
