{
  "id": "PLAN-001",
  "version": 1,
  "goal_id": "P01-G01",
  "goal_revision": 1,
  "created_at": "2026-08-14T17:00:00Z",
  "created_by": "architect",
  "status": "APPROVED",
  "tasks": [
    {
      "id": "T-01",
      "goal_id": "P01-G01",
      "plan_id": "PLAN-001",
      "title": "Parse CLI options",
      "objective": "Support --json flag.",
      "dependencies": [],
      "role": "implementer",
      "status": "PLANNED"
    },
    {
      "id": "T-02",
      "goal_id": "P01-G01",
      "plan_id": "PLAN-001",
      "title": "Emit JSON output",
      "objective": "Format output in JSON.",
      "dependencies": [
        "T-01"
      ],
      "role": "implementer",
      "status": "PLANNED"
    }
  ],
  "edges": [
    {
      "from": "T-01",
      "to": "T-02"
    }
  ]
}